{
  "track_key": "train:123",
  "annotation_split": "train",
  "track_index": 123,
  "source_video_id": "meva_2018-05-16_14-25-01_school_G639_r13",
  "source_video_path": "D:/licensed-data/meva/2018-05-16.14-25-01.14-30-01.school.G639.r13.avi",
  "source_video_sha256": "COMPUTE_FROM_THE_ORIGINAL_VIDEO",
  "source_video_frame_count": 9000,
  "raw_frame_start": 1200,
  "raw_frame_end": 1789,
  "fps": 30.0,
  "capture_session_id": "mevid_session_2018-05-16_school_G639",
  "capture_period": "2018-05-16T14:25:01Z",
  "camera_id": "G639",
  "view_condition": "oblique",
  "walking_verified": true,
  "walking_direction": "lateral",
  "load_condition": "empty_hands",
  "occlusion_level": "none",
  "adverse_quality_condition": "normal",
  "consent_id": "MEVA_LICENSE_RECORD_ID",
  "license_status": "approved_for_this_use",
  "manual_review_id": "REVIEW_RECORD_ID",
  "metadata_version": "mevid-cross-event-source-v1"
}
